title,content,date
Living In The Past,"The advent of the talkies created possibly the biggest-ever upheaval in the history of Hollywood and the impact it had on the careers of a large number of the industry's popular stars at that time was enormous. Many whose voices seemed unacceptable because they were incompatible with their image or because of a heavy foreign accent found themselves out of work as did others who were simply unable to adapt to the demands of the new era. Billy Wilder's ""Sunset Boulevard"" provides a fascinating insight into some of the more ruthless and unpleasant facets of the Hollywood system in a style that's witty cynical and realistic and also features a number of actors whose careers were profoundly affected by the arrival of the talkies.Joe Gillis (William Holden) a struggling Hollywood screenwriter with more debts than he can handle becomes involved in a high-speed chase when he tries to avoid the attentions of a couple of guys who are intent on repossessing his car. When one of his tyres blows out he swiftly turns into the driveway of a run down mansion and successfully evades his pursuers. After parking his vehicle in the garage he's surprised that the occupants of the mansion seem to be expecting him. It soon transpires that they'd assumed that he was the mortician who was due to deliver a coffin in which the lady of the house's dead chimpanzee was to be buried. Joe recognises the lady as Norma Desmond (Gloria Swanson) a former silent movie star.When Norma discovers that Joe's a writer she seeks his opinion of a script she'd written for her comeback movie (""Salome"") and then hires him to edit her work. In his financial circumstances the offer of this lucrative job is too good to refuse and at her request he agrees to stay at her mansion to complete the task. Joe recognises that Norma is a delusional has-been who lives in the past and discovers that the fan mail she receives every week is actually written by her devoted butler Max (Erich von Stroheim). The very wealthy Norma buys Joe expensive new suits and coats and together they watch her old movies a few times each week. Even more bizarrely on New Year's Eve she holds a party at which there's an orchestra but no other guests! Joe feels he needs to escape from Norma who's obviously fallen in love with him and so goes to a friend's party instead.Artie Green (Jack Webb) agrees for Joe to stay over at his place and Joe soon gets into conversation with Artie's girlfriend Betty Schaefer (Nancy Olsen). Joe already knew Betty who worked as a script reader for Paramount and the two of them subsequently start to work together on one of Joe's unfinished scripts. When Norma discovers what's going on she becomes incensed and determined to bring their association to an end.The most striking feature of ""Sunset Boulevard"" is its sharp dialogue and numerous quotable lines which vary from the purely witty to the deeply sardonic. The fact that these lines are delivered by a screenwriter and a particularly flamboyant retired actress makes their exchanges seem perfectly credible as both characters would naturally have developed a way with words during their careers.The film's opening scene in which Joe is seen dead and face down in Norma's swimming pool is brilliantly shot and the off-beat device of having a dead man narrating the story is typical of the cynicism and dark humour that runs through everything that follows. At this point when objectively talking about himself Joe in typical style remarks ""the poor dope. He always wanted a pool. Well in the end he got himself a pool"".The casting of Gloria Swanson and Erich von Stroheim who both had careers in silent movies invests the events depicted with a great deal of realism as do the cameos in which Cecil B DeMille Hedda Hopper Buster Keaton and others are featured. Shots of Paramount studios and Schwab's Drugstore and the inclusion of an excerpt from ""Queen Kelly"" (1929) in which Swanson starred and von Stroheim directed also blur the lines between fiction and reality and add greater authenticity to the whole production.""Sunset Boulevard"" focuses on some of the more unglamourous aspects of Hollywood and must've made uncomfortable viewing for some people in the industry at that time. Its blend of biting humour and tragedy is very effective and the performances of its exceptional cast are consistently good from start to finish.",2 February 2015
A Bitter and Tragic Masterpiece,"In Hollywood of the 50's the obscure screenplay writer Joe Gillis (William Holden) is not able to sell his work to the studios is full of debts and is thinking in returning to his hometown to work in an office. While trying to escape from his creditors he has a flat tire and parks his car in a decadent mansion in Sunset Boulevard. He meets the owner and former silent-movie star Norma Desmond (Gloria Swanson) who lives alone wit her butler and driver Max von Mayerling (Erich von Stroheim). Norma is demented and believes she will return to the cinema industry and is protected and isolated from the world by Max who was his director and husband in the past and still loves her. Norma proposes Joe to move to the mansion and help her in writing a screenplay for her comeback to the cinema and the small-time writer becomes her lover and gigolo. When Joe falls in love for the young aspirant writer Betty Schaefer (Nancy Olson) Norma becomes jealous and completely insane and her madness leads to a tragic end.""Sunset Boulevard"" is a bitter and tragic masterpiece of the genius Billy Wilder that exposes how Hollywood uses people and forgets them when they get old and are considered decadent by the industry. Further it also shows the consequences of the lack of adaptation of a former star to the end of a successful career being forgotten by fans and the industry and the price that some persons accept to pay to join this business. The last time I saw this film was on 22 September 2002 and even having watched ""Sunset Boulevard"" for maybe five or six times I still get excited with most of the scenes and I dare to say that it is in my Top 10 movies ever. The DVD has an interesting documentary called ""Sunset Blvd.: A Look Back"" (a.k.a. ""The Making of Sunset Boulevard"" with the presence of a still impressively beautiful Nancy Olson telling peculiarities about this awesome feature. My vote is ten.Title (Brazil): ""Crepúsculo dos Deuses"" (""Dusk of the Gods"")",18 January 2008
Alright Sunset BLVD are you ready for your close up?,The movie is still big. It's the pictures that got small. There is nothing like watching Sunset Boulevard. It's a great movie that need to be in the center of attention. Name after a Boulevard in Los Angeles this film noir was directed and co-written by Billy Wilder who destroy forever the iconic Hollywood image with his dark tale of greed and the lust of everlasting fame. The film stars William Holden as Joe Gillis an unsuccessful screenwriter who happen to come upon a faded silent movie starlet Norma Desmond (Gloria Swanson) who draws him into her fantasy world where she dreams of making a triumphant return to the screen. William Holden is great in the role as a man struggling to keep his masculinity. I like his moral decision in the end of the film. Serve them right. In a way this movie was indeed William Holden comeback film as well as he fallen from the starlight after 1939's Golden Boys. Gloria Swanson is scary charming and brilliant in the Femme fatale manipulative role. She does over act a bit but that comes with the part. She's pretty much playing an extreme version of herself. Gloria herself was trying to have a comeback with this film after a number of fails films include one with Director Erich von Stroheim in 1929's Queen Kelly. Art is mirroring real life as Erich von Stroheim stars as Max Von Mayerling her butler and the director that discovered her. There is even a chilling theater scene with all the main characters watching the film Queen Kelly. Erich von Stroheim is just amazing in this film and I have become a fan of his works. I didn't like Nancy Olson so much as Betty Schaefer as I felt she was way too chirpy for my taste and in your face shouting acting. I do like the silent film stars cameos like Director Cecil B. DeMille Buster Keaton H. B. Warner and Anna Q. Nilsson. I do like the cameo of the set of 1949's DeMille's Samson and Delilah. It makes the film seems more real to Hollywood to know that another real life film was really taking place there. While the characters could had been nearly unlikeable Billy Wilder's comedy charm gives this movie some room to breathe. I have to praise the writing. It's amazing. Yes some of the jokes went over my head but the film was balance well enough for the drama and the comedy not to feel overloaded. The narrative of film noirs are usually characterized as multifaceted and often confusing. It does commonly entailing the use of flashback and first-person voice-over narration. I'm pretty glad they open the film with the shot of the swimming pool rather than having two corpses talking to each other at the morgue. I think it does sound stupid so I'm glad they use the dead body in the swimming pool idea. The corpse floating in the pool in the film's opening scene. The desired image proved difficult to achieve and the problem was resolved by placing mirrors on the bottom of the swimming pool and filming from above. The underwater shot was pretty impressed at the time. The visual effects are amazing. Sunset Boulevard uses a lot of high-contrast lighting in Norma's house that creates dark shadows that works well. The lighting and the setting is to show the character is suffocating in their life. Norma is ever looking for the light. I love the foggy blur that it create when people get near it. It's symbolism at its best. The film also contains some German-expressionistic element such as the oblique vertical and horizontal angles. For some interior shots the crew sprinkled dust in front of the camera before filming to suggest dirty or unclean. The house was old and nice. The way the photographs were surrounding. It look like some odd Gothic church. The house was later used by Nicholas Ray's 1955's Rebel Without a Cause. It was pretty interesting. The score was composed by Franz Waxman was pretty good. Nothing worth noting compare to today's standards. It was just OK at best for me. Here are some faults in the film in my opinion. The narrating goes a little bit too long. Show don't tell. Plus how do dead-men can do a narration anyways? Aren't they dead? The whole blooming Gillis-Betty relationship seem out of place as well. I know it's needed for the plot but it's seem forced. I just don't see Betty having much interested in a man she barely sees. The story was a bit influence by the real life tragedy of Mabel Normand and William Desmond Taylor in which William Desmond got shot and killed. This film marks the first time that Hollywood was view in a negative light on film. The theme of this movie is that Hollywood creates dreams and stars and then leaves them with nothing but their own outdated fantasies. In the other side of the coin some people are so hungry for the fame that they are willing to do anything for a shot at it even destroying lives. Hollywood still love and hate the film for its criticism of the movie industry. It's still a bit controversial ever today. Wilder show us the real Hollywood where few people had success and many fails. People mustn't starve for fame too long else they risk being trapped in a world of their own making a world where they become bitter and delude.,6 September 2013
Reel Life Gothic,"Every time I go to L.A. which isn't too often I look at these palm-bemused once smart stucco facades and wonder if a Norma Desmond from a later era might be hiding from the world inside them buttressed by cable TV (AMC or TCM no doubt) a poodle named FiFi or Sir Francis walk-in closets full of leopard-print Capri pants that haven't fit in decades and a world class liquor cabinet that has seen heads of state under the table on a good night. It is because of Sunset Blvd. for certain that my mind could ever go there. It is one of the most indelible films you will ever see.This film is great for many reasons not the least of which is because it is Hollywood's first look back at itself. In the milieu of this film the silent era is only 22 years behind us. The people left behind by the rush to sound can still palpably TASTE the fame the accolade that particular past being not so very dim and distant. The sadness of their lives was real and at that point in history all around if hidden. Way more has been made of the supposed ""savagery"" of this film vis a vis the faded star than I think exists now or ever did. The often cynical Wilder is deeply in touch with the tragic here as much as the grotesque.",16 September 2001
The Wild Roller-coaster of Fame,In many ways Sunset Boulevard is like the reverse side of the coin of A Star Is Born. In that film we have young Vicki Lester going through all the travails and heartache before achieving her goal of movie stardom. Sunset Boulevard is the reverse. A Star Is Born has its tragic figure in Norman Maine who commits suicide rather than face being a has been. In Sunset Boulevard we have the character of Norma Desmond who has not taken that route. She lacks for nothing in the material world she wisely saved and invested her money. But the acclaim of the audience is a drug she craves. She's been at the top on the celebrity roller-coaster and now is at the bottom.Into her life comes Joe Gillis quite accidentally. Fleeing from some repo men looking to take his car Gillis drives into the garage of what he thinks is a deserted mansion. It looks pretty run down from the outside. Gillis compares it to the house of Miss Faversham from Great Expectations little knowing how right he was.Billy Wilder was a casting genius though in some ways he fell into the cast he had. Gloria Swanson was not his first choice he approached both Mary Pickford and Pola Negri for the Desmond role first. Gloria Swanson who actually had made the transition to sound well but had gone on to stage and radio since her success in Music in the Air drew from the experiences of many of her colleagues. At the time she was cast in Sunset Boulevard she had a radio show out of New York.Bill Holden was sheer serendipity. Originally Montgomery Clift was to do the part but at the last minute he said no feeling that this was to similar a part to the one he played in The Heiress. Wilder then went through the list of contract leading men at Paramount.Wilder saw something in Holden God bless him. Holden had done a whole series of what he termed 'smiling Jim' roles. He was considered an amiable and non-threatening leading man. Although he had done well in a role as a psychotic killer in The Dark Past Sunset Boulevard brought him his first real acclaim as an actor. An Academy Award nomination came with the acclaim.Nancy Olson and Erich Von Stroheim were nominated in the Best Supporting Player categories as was Swanson for Best Actress. Von Stroheim was another inspired choice. His is a strange part indeed. He was Desmond's first director in silent films and left his career behind to take care of her. He was also her first husband. Sunset Boulevard for it's time and with the Code firmly in place was a brutal look at the sexual needs of a middle-aged woman. Before Holden knows it he's giving up his life as an aspiring screenwriter to be a kept gigolo. He doesn't like it but can't leave it. When he does it results in tragedy.Nancy Olson plays a reader at Paramount studios where Holden is trying to sell a script. She and Holden had good chemistry and after this they did four more films together. Casting Cecil B. DeMille as himself was of necessity for who could play the great DeMille but DeMille. DeMille in fact was a former actor and playwright at the turn of the last century. In his autobiography DeMille lets us in on a private joke. He in fact did direct many of Gloria Swanson's early silent films and a pet name he had for her was 'young fella.' Note that when Norma Desmond comes to the Paramount lot to see him he greets her with that same expression. Note that DeMille got a plug for his own film Samson and Delilah which was in production at the same time. It is the set of that film where Swanson and DeMille meet.You will never forget the finely etched characters of Sunset Boulevard. You can see it many times as I've done but if you see it only once you will have it burned in your memory. Especially that last scene before the newsreel cameras where Swanson loses whatever sanity she has left. She descends down the stairs of her mansion and descends into the comfort of insanity.I've often wondered should a sequel have been done covering the trial of Norma Desmond. I'm sure Billy Wilder wanted to move on to other projects. Still that would have been a film to see.,26 January 2006
They Don't Make 'Em Like This Anymore,"This is such a great film on so many levels I can't really settle on where to begin. It is so beautifully shot (in that stark black/white that only nitrate negative could achieve) has a witty clever and extremely well-written script features some of the best acting in film's history acrobatically balances the main plot/subplots with expert precision contains some of the best characters on celluloid has many true-to-life parallels (Swanson's career/real life cameos/DeMille's involvement/etc) and is peppered with such great dialogue/narration that today's film writers should take note. If that weren't enough there's even a cameo by silent film great Buster Keaton (among others).One of the most appealing aspects of this film is how in the story an aging forgotten star is trying to recapture a bygone era (the silent film era). What's interesting is that now so many years later we're looking back at her looking back. To present day viewers Gloria Swanson of the 1950's is a long forgotten lost gem and to experience her own longing for the 1920's is especially captivating (and a little chilling I might add). I don't think this film could have had that same effect when it debuted and maybe this added dimension holds so much more appeal for today's audiences. We all know that nothing lasts forever but we don't often consider the abandoned participants; much like the veterans of a past war.In response to the famous Swanson line (while watching one of her silent films): ""...we didn't need dialogue; we had faces"" I'd like to also add that they ""didn't need movies; they had films.""They truly don't make them like this anymore. 10/10",2 July 2004
The films that SHOULD have won Oscar for Best Picture: 1951,"This was the first of Billy Wilder's work I've even seen sure I've heard of him just not seen any of his movies. Made in the fifty's ""Sunset Blvd."" is simply timeless & it's easy to see why this movie of a washed up writer/ turned gigolo to a washed-up has-been actress is rated so highly. A superb indictment of everything that's wrong and distasteful about Hollywood and probably even truer now that it actually was when it was made. This film is also crammed with in-jokes and references that practically beg for multiple viewings. The acting by everyone is perfect & this movie is such a wonder to behold.DVD Extras: Audio commentary with author of ""On Sunset Boulevard: The Life And Times Of Billy Wilder"" Ed Sikov ; Three featureless (""The Making Of Sunset Boulevard""; ""The Music Of Sundet Boulevard"" and ""Edith Head: The Paramount Years"") ;Morgue prologue; ""Hollywood Location"" map;Photo galleries; Theatrical trailerMy Grade: A+",18 December 2004
All right Mr. DeMille,"Gloria Swanson must be commended for her bravery in taking a part which may or may not have echoed her own Hollywood career. William Holden took a role which required him to be a kept boy; and he's not the nicest guy in the world either. If this had been made with Mae West and Montgomery Clift I would probably not be writing this and no one else would give a damn about this movie either.Both of them got Oscar nominations and I am sorry both lost. I am also sorry that ""All About Eve"" won Best Picture that year. Of course ""Eve"" is a great movie but its not this.This movie is part of our collective memory and most of the dialogue continues to be quoted even today. Thank God for whatever it was that brought Billy Wilder to Hollywood. I can't think of anyone who did such a wide variety of movies so well.And please no remakes.",14 March 2000
"Says Holden: ""I sure drove into an interesting driveway...""","WILLIAM HOLDEN really hits his stride in the role of Joe Gillis the down-on-his-heels writer who just happens to be drowning in debt before he comes upon a secluded and decaying mansion that is about to change his life. Wilder's script gives him plenty of opportunity to shine. His typically witty quip to servant Erich Von Stroheim is: ""I sure drove into an interesting driveway"" (after realizing Swanson intends to hold a funeral for her pet monkey). It's the kind of remark that stays with you through the entire story.Holden inhabits the role so perfectly that we can be thankful Montgomery Clift turned down the role at the last moment. And the screenplay by Billy Wilder provides plenty of other cynical and observant wise cracks that give his character of Joe Gillis such depth conviction and truth.And of course GLORIA SWANSON as Norma Desmond in what has to be regarded as her film swansong (she did very little thereafter) is every inch the faded silent screen star who lives inside her rich imagination inflating her ego with self-important phrases like: ""It's the pictures that got small."" With her cat-like eyes and claw-like hand gestures she gets every nuance out of a role that is theatrical and larger than life right up to the fantastic ending. One can almost sense why Andrew Lloyd Webber would fashion this into a terrific Broadway musical.Her meeting with Cecil B. DeMille on the set of a Paramount costume epic is priceless for the way it is written and played. When at the conclusion of the film she says: ""I'm ready for my close-up Mr. DeMille"" it's a truly poignant moment.All of the supporting players are excellent including NANCY OLSON as the writer girlfriend that Holden shields from the truth until that final scene where he invites her to come over to the Sunset Blvd. mansion and exposes the sordid truth of his relationship with Swanson.As the man servant who is Swanson's loyal protector and was once Swanson's first husband and director of her early films ERICH VON STROHEIM easily matches Holden and Swanson with a fine characterization of the patiently devoted butler.Swanson plays the demented star like a more glamorous version of Miss Havisham in GREAT EXPECTATIONS the woman who lived among the cobwebs because of a bitter disappointment when a lover jilted her on her wedding day. And like Miss Havisham she refuses to deal with the reality of her situation when the going gets rough--as it does when it turns out nobody wants her at the studios any more they were only interested in her antique auto.Some old time Hollywoodians get some cameos (Buster Keaton H.B. Warner) which give the film added interest and even Hedda Hopper is on the scene as a brusque Hollywood reporter. All of the technical details are perfect. Franz Waxman's score has a Salome-like flavor especially toward the end when Swanson is in the full throes of her delusions.Expertly photographed written directed and acted this is a film that has to be watched closely to fully appreciate every detail. With its superior script it mixes film noir black comedy and dark melodrama with a nice blend of shadowy noir B&W photography that has that Paramount sheen. A viewer is immediately drawn into the story which gets off to a brilliant start with Holden's brittle narration the kind that strips all the phoniness away from any Hollywood pretension of glamor. Summing up: Highly recommended for mature adults. Holden's corpse floating face downward eyes open in the water of the lighted swimming pool is the stylish stuff that film noir addicts dream of.And Swanson's brief moment mimicking Charlie Chaplin is priceless.Trivia note: Holden's performance is right on target--the perfect degree of cynicism disdain and self-loathing. He should have won an Oscar here.",28 August 2005
Masterpiece.,I dare any studio producer director to make TODAY anything even close to that film.,1 August 2019
